{
  "schema_version": "1.1.0",
  "template_ref": {
    "id": "qte.instant_intercept",
    "version": "1.0.0"
  },
  "decision_status": {
    "open": [
      "calibration_contract.parameters",
      "mechanics.control_model",
      "mechanics.cue_nodes",
      "fun_contract.action_patterns",
      "fun_contract.climax",
      "fun_contract.replay_policy",
      "difficulty.phases"
    ],
    "defaulted": [
      "mechanics.clock",
      "mechanics.state_machine",
      "fun_contract.anti_autoplay"
    ],
    "locked": [
      "template_ref",
      "mechanics.input_policy.after_resolved",
      "calibration_contract.policy"
    ]
  },
  "identity": {
    "id": "game_qte_example",
    "title": "{游戏名称}",
    "theme": "{题材}"
  },
  "target": {
    "scope": "standalone",
    "platform": "mobile_h5",
    "orientation": "portrait",
    "session_duration_param": "session_duration",
    "input_devices": [
      "touch",
      "pointer"
    ]
  },
  "intent": {
    "player_fantasy": "{玩家在危险瞬间靠自己的操作完成拦截}",
    "primary_verb": "intercept",
    "core_loop": [
      "危险或机会出现",
      "展示可读预警",
      "开启输入窗口",
      "玩家执行有承诺的语义动作",
      "系统唯一判定",
      "播放分级反馈",
      "清理并进入下一模式"
    ],
    "experience_claims": [
      {
        "mechanism": "可读预警、真实操作成本与分级判定",
        "behavior": "玩家识别威胁，决定动作并承担位移、方向或时机承诺",
        "feeling": "惊险但可掌握的临场救场感",
        "observable_signal": "玩家第二局能主动修正时机、路径或目标选择，而不是只背固定序列"
      }
    ]
  },
  "theme_mapping": {
    "threat_source": "{危险从哪里出现}",
    "threat_object": "{需要拦截的对象}",
    "telegraph": "{危险出现前的提示}",
    "intercept_target": "{正确目标、方向、路径或交点}",
    "player_action": "{点击、滑动或拖拽动作}",
    "success_result": "{成功后发生什么}",
    "failure_result": "{失败后发生什么并如何归因}"
  },
  "state": {
    "variables": []
  },
  "calibration_contract": {
    "policy": "game_specific_not_global_defaults",
    "parameters": [
      {
        "id": "session_duration",
        "unit": "seconds",
        "domain": "positive",
        "scope": "session",
        "status": "open",
        "value": null,
        "source": "由目标场景、核心模式数量和真人试玩节奏决定",
        "constraints": "为正，并足以容纳已声明阶段与转换；不以统一局长为边界",
        "validation_signal": "玩家在疲劳前经历教学、变化、恢复与高潮，并愿意立即重玩"
      },
      {
        "id": "input_latency_compensation",
        "unit": "ms",
        "domain": "signed",
        "scope": "input",
        "status": "open",
        "value": null,
        "source": "由目标设备的事件时间戳与实测输入延迟决定",
        "constraints": "只能补偿测得的系统性偏差，不能把技能误差整体抹平",
        "validation_signal": "相同语义输入在目标设备上边界归属稳定"
      },
      {
        "id": "telegraph_base",
        "unit": "ms",
        "domain": "positive",
        "scope": "cue",
        "status": "open",
        "value": null,
        "source": "由预警信息量、动作类型和低分位识别时间决定",
        "constraints": "预警先于开窗，且不通过无意义等待伪造可读性",
        "validation_signal": "玩家能在开窗前说清目标和动作"
      },
      {
        "id": "input_window_base",
        "unit": "ms",
        "domain": "positive",
        "scope": "cue",
        "status": "open",
        "value": null,
        "source": "由动作完成成本、设备延迟和目标玩家实测分布决定",
        "constraints": "窗口为正，并覆盖合法动作而不允许被动或随机策略稳定成功",
        "validation_signal": "失败来自可修正操作，而非不可达窗口"
      },
      {
        "id": "recovery_base",
        "unit": "ms",
        "domain": "nonnegative",
        "scope": "cue",
        "status": "open",
        "value": null,
        "source": "由前一模式负荷、反馈收束和下一预警需要决定",
        "constraints": "不得阻塞逻辑推进，也不得形成没有主动反馈的空等",
        "validation_signal": "恢复降低负荷但不形成无意义等待"
      },
      {
        "id": "target_size_base",
        "unit": "css_px",
        "domain": "positive",
        "scope": "cue",
        "status": "open",
        "value": null,
        "source": "由目标设备、手指遮挡、操作精度与画面布局实测决定",
        "constraints": "交互区域位于安全区，视觉大小与逻辑命中区域一致",
        "validation_signal": "目标可辨识且命中误差符合所声明技能轴"
      },
      {
        "id": "concurrency_limit",
        "unit": "count",
        "domain": "positive_integer",
        "scope": "phase",
        "status": "open",
        "value": null,
        "source": "由并发是否产生选择而非无解重叠，并经可达性验证决定",
        "constraints": "为可实现的有限整数，所有强制组合都可达或有明确安全取舍",
        "validation_signal": "每个同时出现的强制 cue 都有合法处理或明确取舍"
      },
      {
        "id": "cue_trigger_offset",
        "unit": "ms",
        "domain": "nonnegative",
        "scope": "cue.tutorial_intercept",
        "status": "open",
        "value": null,
        "source": "由上一个节点退出与当前 tell 阶段的节奏决定",
        "constraints": "不早于上一个节点清理完成，也不制造出生即判定",
        "validation_signal": "cue 不会出生即判定，也不产生空等"
      },
      {
        "id": "cue_window_open_offset",
        "unit": "ms",
        "domain": "nonnegative",
        "scope": "cue.tutorial_intercept",
        "status": "open",
        "value": null,
        "source": "由 tell 完成和玩家可开始动作的时刻决定",
        "constraints": "不早于玩家可理解预警的时刻，并早于关闭偏移",
        "validation_signal": "预警先于开窗且边界可复现"
      },
      {
        "id": "cue_window_close_offset",
        "unit": "ms",
        "domain": "positive",
        "scope": "cue.tutorial_intercept",
        "status": "open",
        "value": null,
        "source": "由动作完成成本与容错目标决定",
        "constraints": "晚于开窗偏移，且从最不利合法起点仍存在完成路径",
        "validation_signal": "最不利合法起点仍存在可达路径"
      },
      {
        "id": "perfect_timing_tolerance",
        "unit": "ms",
        "domain": "positive",
        "scope": "judgement",
        "status": "open",
        "value": null,
        "source": "由高手实测误差分布和设备抖动决定",
        "constraints": "严格包含于基础成功范围，只区分 mastery 而不成为通关前提",
        "validation_signal": "最高评级能区分熟练度但不是通关前提"
      },
      {
        "id": "success_timing_tolerance",
        "unit": "ms",
        "domain": "positive",
        "scope": "judgement",
        "status": "open",
        "value": null,
        "source": "由基础可达性和目标完成率实测决定",
        "constraints": "覆盖合法动作成本，且 Early/Late 边界连续无空洞",
        "validation_signal": "基础成功边界公平且 Early/Late 原因可解释"
      },
      {
        "id": "overlap_tolerance",
        "unit": "ratio",
        "domain": "ratio",
        "scope": "judgement",
        "status": "open",
        "value": null,
        "source": "由目标形状、手指遮挡和碰撞可读性决定",
        "constraints": "位于合法比例域，且视觉接触与逻辑重叠含义一致",
        "validation_signal": "视觉接触与逻辑命中一致"
      },
      {
        "id": "feedback_start_latency",
        "unit": "ms",
        "domain": "nonnegative",
        "scope": "feedback",
        "status": "open",
        "value": null,
        "source": "由目标设备事件到首个可见反馈的实测决定",
        "constraints": "反馈可归因到当前动作，并在下一冲突预警前收束或降级",
        "validation_signal": "玩家把反馈归因到刚完成的动作，且不遮挡下一预警"
      }
    ]
  },
  "mechanics": {
    "clock": {
      "source": "monotonic",
      "deadline_policy": "timestamp_comparison",
      "pause_policy": "freeze_timeline",
      "background_policy": "auto_pause",
      "calibration_offset_param": "input_latency_compensation"
    },
    "state_machine": {
      "initial_state": "ready",
      "states": [
        "ready",
        "telegraph",
        "window_open",
        "resolved",
        "recovery",
        "disposed"
      ]
    },
    "input_policy": {
      "allowed_actions": [
        "drag_intercept",
        "swipe_direction"
      ],
      "resolution": "first_attempt",
      "early_input": "ignore",
      "wrong_input": "miss",
      "multi_touch": "single_pointer",
      "after_resolved": "ignore",
      "candidate_matching": "earliest_legal_cue"
    },
    "control_model": {
      "type": "direct_drag",
      "difficulty_basis": "真实手指位移、路径保持、目标选择和时机承诺；不得把点击瞬移后的车道距离当作难度",
      "movement_authority": "pointer_path"
    },
    "cue_defaults": {
      "telegraph_param": "telegraph_base",
      "input_window_param": "input_window_base",
      "recovery_param": "recovery_base",
      "minimum_target_size_param": "target_size_base",
      "concurrency_mode": "authored_choice",
      "concurrency_limit_param": "concurrency_limit"
    },
    "cue_nodes": [
      {
        "id": "tutorial_intercept",
        "pattern_id": "commit_intercept",
        "subtype": "drag_intercept",
        "trigger": {
          "type": "timeline",
          "at_param": "cue_trigger_offset",
          "event": null
        },
        "content": {
          "threat": "{危险对象}",
          "telegraph": "{显示来源、方向和到达点的预警}",
          "target": "{拦截区域}",
          "instruction": "{用题材动作说明如何拦截}"
        },
        "input": {
          "action": "drag_intercept",
          "target_id": "intercept_zone_01"
        },
        "timing": {
          "telegraph_param": "telegraph_base",
          "window_open_offset_param": "cue_window_open_offset",
          "window_close_offset_param": "cue_window_close_offset"
        },
        "judgements": [
          {
            "grade": "perfect",
            "priority": 2,
            "requirements": [
              {
                "type": "signed_timing_error",
                "parameter_refs": [
                  "perfect_timing_tolerance"
                ]
              },
              {
                "type": "overlap_ratio",
                "parameter_refs": [
                  "overlap_tolerance"
                ],
                "target_id": "intercept_zone_01"
              }
            ]
          },
          {
            "grade": "success",
            "priority": 1,
            "requirements": [
              {
                "type": "signed_timing_error",
                "parameter_refs": [
                  "success_timing_tolerance"
                ]
              },
              {
                "type": "target_match",
                "parameter_refs": [],
                "target_id": "intercept_zone_01"
              }
            ]
          },
          {
            "grade": "miss",
            "priority": 0,
            "otherwise": true
          }
        ],
        "effects": {
          "perfect": [
            {"op": "emit", "event": "qte_perfect"}
          ],
          "success": [
            {"op": "emit", "event": "qte_success"}
          ],
          "miss": [
            {"op": "emit", "event": "qte_miss"}
          ]
        }
      }
    ]
  },